{
  "template": "single-partner",
  "language": "en",
  "headline": "Wallet Connect",
  "subheadline": "",
  "cta": "Open OneKey App > Browser",
  "items": [
    {
      "name": "OneKey",
      "logo": "brand-assets/OneKey_社媒图AI规范/logos/logo_常用/logomark_浅色背景使用/icon-only.svg"
    },
    {
      "name": "dApp",
      "logo": ""
    }
  ]
}
